### ISSUE TITLE
0.13.0 Beta 5: WARNING : Unable to keep up with recording segments in cache for 

### ISSUE THREAD

**Issue by doug62** [blakeblackshear/frigate#8677]
### Describe the problem you are having

With the subject beta, all cams fail with subject error - previously working with stable

### Version

0.13.0 Beta 5

### Frigate config file

```yaml
mouse:
          - rtsp://xx:password@cam-mouse.lan.xxxx

    cameras:
      mouse:
        ffmpeg:
          inputs:
            - path: rtsp://127.0.0.1:8554/mouse
              roles:
                - detect
                - record
        rtmp: 
          enabled: False
        detect:
          width: 1280
          height: 720
          fps: 1
        objects:
          track:
            - mouse
```

### Relevant log output

```shell
2023-11-20 02:48:12.554511204  10.42.0.1 - - [20/Nov/2023:02:48:12 +0000] "GET /api/mouse/latest.jpg?h=100 HTTP/1.1" 499 0 "https://frigate.k8.cloud10.systems/" "Mozilla/5.0 (Windows NT 10.0; Win64; x64) AppleWebKit/537.36 (KHTML, like Gecko) Chrome/119.0.0.0 Safari/537.36" "10.0.2.91"
2023-11-20 02:48:12.554512746  10.42.0.1 - - [20/Nov/2023:02:48:12 +0000] "GET /api/Family/latest.jpg?h=371 HTTP/1.1" 499 0 "https://frigate.k8.cloud10.systems/" "Mozilla/5.0 (Windows NT 10.0; Win64; x64) AppleWebKit/537.36 (KHTML, like Gecko) Chrome/119.0.0.0 Safari/537.36" "10.0.2.91"
2023-11-20 02:48:13.231477307  10.42.0.1 - - [20/Nov/2023:02:48:13 +0000] "GET /api/FrontDoor/latest.jpg?h=376 HTTP/1.1" 200 10322 "https://frigate.k8.cloud10.systems/" "Mozilla/5.0 (Windows NT 10.0; Win64; x64) AppleWebKit/537.36 (KHTML, like Gecko) Chrome/119.0.0.0 Safari/537.36" "10.0.2.91"
2023-11-20 02:48:13.233059068  10.42.0.1 - - [20/Nov/2023:02:48:13 +0000] "GET /api/Family/latest.jpg?h=376 HTTP/1.1" 200 10322 "https://frigate.k8.cloud10.systems/" "Mozilla/5.0 (Windows NT 10.0; Win64; x64) AppleWebKit/537.36 (KHTML, like Gecko) Chrome/119.0.0.0 Safari/537.36" "10.0.2.91"
2023-11-20 02:48:13.235516991  10.42.0.1 - - [20/Nov/2023:02:48:13 +0000] "GET /api/Garage/latest.jpg?h=376 HTTP/1.1" 200 10322 "https://frigate.k8.cloud10.systems/" "Mozilla/5.0 (Windows NT 10.0; Win64; x64) AppleWebKit/537.36 (KHTML, like Gecko) Chrome/119.0.0.0 Safari/537.36" "10.0.2.91"
2023-11-20 02:48:13.237049780  10.42.0.1 - - [20/Nov/2023:02:48:13 +0000] "GET /api/mouse/latest.jpg?h=376 HTTP/1.1" 200 10322 "https://frigate.k8.cloud10.systems/" "Mozilla/5.0 (Windows NT 10.0; Win64; x64) AppleWebKit/537.36 (KHTML, like Gecko) Chrome/119.0.0.0 Safari/537.36" "10.0.2.91"
2023-11-20 02:48:13.239288550  10.42.0.1 - - [20/Nov/2023:02:48:13 +0000] "GET /api/GarageWide/latest.jpg?h=251 HTTP/1.1" 200 5657 "https://frigate.k8.cloud10.systems/" "Mozilla/5.0 (Windows NT 10.0; Win64; x64) AppleWebKit/537.36 (KHTML, like Gecko) Chrome/119.0.0.0 Safari/537.36" "10.0.2.91"
2023-11-20 02:48:13.241202919  10.42.0.1 - - [20/Nov/2023:02:48:13 +0000] "GET /api/lobby/latest.jpg?h=376 HTTP/1.1" 200 10322 "https://frigate.k8.cloud10.systems/" "Mozilla/5.0 (Windows NT 10.0; Win64; x64) AppleWebKit/537.36 (KHTML, like Gecko) Chrome/119.0.0.0 Safari/537.36" "10.0.2.91"
2023-11-20 02:48:13.242792064  10.42.0.1 - - [20/Nov/2023:02:48:13 +0000] "GET /api/FrontHigha/latest.jpg?h=251 HTTP/1.1" 200 5657 "https://frigate.k8.cloud10.systems/" "Mozilla/5.0 (Windows NT 10.0; Win64; x64) AppleWebKit/537.36 (KHTML, like Gecko) Chrome/119.0.0.0 Safari/537.36" "10.0.2.91"
2023-11-20 02:48:14.767011398  [2023-11-20 02:48:14] frigate.video                  ERROR   : Garage: Unable to read frames from ffmpeg process.
2023-11-20 02:48:14.767077387  [2023-11-20 02:48:14] frigate.video                  ERROR   : Garage: ffmpeg process is not running. exiting capture thread...
2023-11-20 02:48:15.660227065  02:48:15.659 WRN [rtsp] error="streams: dial tcp 10.0.0.24:554: i/o timeout" stream=garage
2023-11-20 02:48:16.156264874  [2023-11-20 02:48:16] frigate.record.maintainer      WARNING : Unable to keep up with recording segments in cache for FrontHigha. Keeping the 5 most recent segments out of 6 and discarding the rest...
2023-11-20 02:48:16.156427145  [2023-11-20 02:48:16] frigate.record.maintainer      WARNING : Unable to keep up with recording segments in cache for FrontDoor. Keeping the 5 most recent segments out of 6 and discarding the rest...
2023-11-20 02:48:16.156783156  [2023-11-20 02:48:16] frigate.record.maintainer      WARNING : Unable to keep up with recording segments in cache for mouse. Keeping the 5 most recent segments out of 6 and discarding the rest...
2023-11-20 02:48:16.156918812  [2023-11-20 02:48:16] frigate.record.maintainer      WARNING : Unable to keep up with recording segments in cache for Family. Keeping the 5 most recent segments out of 6 and discarding the rest...
2023-11-20 02:48:16.190408207  [h264 @ 0x7f85e864dcc0] error while decoding MB 76 56, bytestream -15
2023-11-20 02:48:18.595323902  02:48:18.595 WRN github.com/AlexxIT/go2rtc/internal/streams/producer.go:171 > error="read tcp 10.42.0.210:50978->10.0.0.23:554: i/o timeout" url=rtsp://Admin:password@cam-mouse.lan.cloud10.systems/live
2023-11-20 02:48:18.716427507  02:48:18.716 WRN github.com/AlexxIT/go2rtc/internal/streams/producer.go:171 > error="read tcp 10.42.0.210:42502->10.0.0.21:554: i/o timeout" url=rtsp://Admin:password@cam-family.lan.cloud10.systems/live
2023-11-20 02:48:19.657527143  [2023-11-20 02:48:19] watchdog.Garage                ERROR   : Ffmpeg process crashed unexpectedly for Garage.
```

### FFprobe output from your camera

```shell
xxx
```

### Operating system

HassOS

### Install method

Docker Compose

### Coral version

CPU (no coral)

### Network connection

Wired

### Camera make and model

ll

### Any other information that may be helpful

Install method: Kubernetes - 10 cores, 10 gi ram

**Comment by NickM-27** [comment]
We need to see the full config. The config you're showing doesn't even have record enabled.

**Comment by doug62** [comment]
@blakeblackshear - FUNNY! - No wonder it never detected a mammal mouse, even more funny how it always thought my pets were mice

**Comment by NickM-27** [comment]
based on the snippet of logs included it appears as though the cameras are crashing or timing out, that needs to be addressed in go2rtc

**Comment by doug62** [comment]
@NickM-27 Everything was working when i went from :stable->0.13.0 Beta 5, now 3 different camera brands no longer work.

**Comment by NickM-27** [comment]
right, it would be good to see a full set of go2rtc logs to understand what the problem is. In 0.12 by default go2rtc was quite an old version

**Comment by doug62** [comment]
The go2rtc logs seem unremarkable, Frigate is running in a K8 Pod with 6 cores/6g mem but looks like it is only requiring/using 1 core/1.9Gib ram

Here are the Frigate logs:
2023-11-21 00:44:28.560495820  [2023-11-21 00:44:28] frigate.record.maintainer      WARNING : Unable to keep up with recording segments in cache for GarageWide. Keeping the 5 most recent segments out of 6 and discarding the rest...
2023-11-21 00:44:28.561147988  [2023-11-21 00:44:28] frigate.record.maintainer      WARNING : Unable to keep up with recording segments in cache for FrontDoor. Keeping the 5 most recent segments out of 6 and discarding the rest...
2023-11-21 00:44:28.561483437  [2023-11-21 00:44:28] frigate.record.maintainer      WARNING : Unable to keep up with recording segments in cache for mouse. Keeping the 5 most recent segments out of 6 and discarding the rest...
2023-11-21 00:44:28.561721995  [2023-11-21 00:44:28] frigate.record.maintainer      WARNING : Unable to keep up with recording segments in cache for Family. Keeping the 5 most recent segments out of 6 and discarding the rest...
2023-11-21 00:44:28.562088575  [2023-11-21 00:44:28] frigate.record.maintainer      WARNING : Unable to keep up with recording segments in cache for lobby. Keeping the 5 most recent segments out of 6 and discarding the rest...
2023-11-21 00:44:28.596111384  [h264 @ 0x7f99dc5ff280] error while decoding MB 100 50, bytestream -6
2023-11-21 00:44:31.584829344  [2023-11-21 00:44:31] watchdog.Garage                ERROR   : Ffmpeg process crashed unexpectedly for Garage.
2023-11-21 00:44:31.584972622  [2023-11-21 00:44:31] watchdog.Garage                ERROR   : The following ffmpeg logs include the last 100 lines prior to exit.
2023-11-21 00:44:31.584977541  [2023-11-21 00:44:31] ffmpeg.Garage.detect           ERROR   : rtsp://127.0.0.1:8554/garage: Invalid data found when processing input
2023-11-21 00:44:33.557029220  [2023-11-21 00:44:33] frigate.record.maintainer      WARNING : Unable to keep up with recording segments in cache for GarageWide. Keeping the 5 most recent segments out of 6 and discarding the rest...
2023-11-21 00:44:33.557581338  [2023-11-21 00:44:33] frigate.record.maintainer      WARNING : Unable to keep up with recording segments in cache for FrontHigha. Keeping the 5 most recent segments out of 6 and discarding the rest...

**Comment by NickM-27** [comment]
Please show the go2rtc logs

**Comment by doug62** [comment]
I have since removed all but one camera, the CPU load was 1.12 cores w 8 cams, it is now .4 cores with 1 cam

GO2RTC logs.... (is there a way to lower log level?)
2023-11-21 01:26:50.787415884  [INFO] Preparing go2rtc config...
2023-11-21 01:26:51.014729159  [INFO] Starting go2rtc...
2023-11-21 01:26:51.074364665  01:26:51.074 INF go2rtc version 1.8.2 linux/amd64
2023-11-21 01:26:51.074538297  01:26:51.074 INF [api] listen addr=:1984
2023-11-21 01:26:51.074672641  01:26:51.074 INF [rtsp] listen addr=:8554
2023-11-21 01:26:51.074789739  01:26:51.074 INF [webrtc] listen addr=:8555
2023-11-21 01:27:00.785855588  [INFO] Starting go2rtc healthcheck service...

**Comment by NickM-27** [comment]
Okay, will need to see things with debug logs enabled for recordings

```
logger:
  logs:
    frigate.record.maintainer: debug
```

**Comment by doug62** [comment]
With:
    logger:
      default: debug
      logs:
        frigate.event: debug
        frigate.record.maintainer: debug

Go2rtc:
[FRIGATE](https://frigate.k8.cloud10.systems/)
[FRIGATE](https://frigate.k8.cloud10.systems/)
[Cameras](https://frigate.k8.cloud10.systems/)
[Birdseye](https://frigate.k8.cloud10.systems/birdseye)
[Events](https://frigate.k8.cloud10.systems/events)
[Exports](https://frigate.k8.cloud10.systems/exports)
[Storage](https://frigate.k8.cloud10.systems/storage)
[System](https://frigate.k8.cloud10.systems/system)
[Config](https://frigate.k8.cloud10.systems/config)
[Logs](https://frigate.k8.cloud10.systems/logs)
[Documentation](https://docs.frigate.video/)
[GitHub](https://github.com/blakeblackshear/frigate)
LOGS
Frigate
Go2rtc
Nginx
COPY TO CLIPBOARD
2023-11-22 02:19:46.345277716  [INFO] Preparing go2rtc config...
2023-11-22 02:19:46.549391016  [INFO] Starting go2rtc...
2023-11-22 02:19:46.621240331  02:19:46.621 INF go2rtc version 1.8.2 linux/amd64
2023-11-22 02:19:46.621499089  02:19:46.621 INF [api] listen addr=:1984
2023-11-22 02:19:46.621645776  02:19:46.621 INF [rtsp] listen addr=:8554
2023-11-22 02:19:46.621759570  02:19:46.621 INF [webrtc] listen addr=:8555
2023-11-22 02:19:56.344672426  [INFO] Starting go2rtc healthcheck service...


Frigate;
[FRIGATE](https://frigate.k8.cloud10.systems/)
[FRIGATE](https://frigate.k8.cloud10.systems/)
[Cameras](https://frigate.k8.cloud10.systems/)
[Birdseye](https://frigate.k8.cloud10.systems/birdseye)
[Events](https://frigate.k8.cloud10.systems/events)
[Exports](https://frigate.k8.cloud10.systems/exports)
[Storage](https://frigate.k8.cloud10.systems/storage)
[System](https://frigate.k8.cloud10.systems/system)
[Config](https://frigate.k8.cloud10.systems/config)
[Logs](https://frigate.k8.cloud10.systems/logs)
[Documentation](https://docs.frigate.video/)
[GitHub](https://github.com/blakeblackshear/frigate)
LOGS
Frigate
Go2rtc
Nginx
COPY TO CLIPBOARD
2023-11-22 02:19:46.344405231  [INFO] Preparing Frigate...
2023-11-22 02:19:46.350158932  [INFO] Starting Frigate...
2023-11-22 02:19:47.270371202  [2023-11-22 02:19:47] frigate.app                    INFO    : Starting Frigate (0.13.0-aa93d4f)
2023-11-22 02:19:47.272445774  [2023-11-22 02:19:47] frigate.app                    INFO    : Creating directory: /tmp/cache
2023-11-22 02:19:47.307529691  [2023-11-22 02:19:47] peewee_migrate.logs            INFO    : Starting migrations
2023-11-22 02:19:47.307630000  [2023-11-22 02:19:47] peewee                         DEBUG   : ('CREATE TABLE IF NOT EXISTS "migratehistory" ("id" INTEGER NOT NULL PRIMARY KEY, "name" VARCHAR(255) NOT NULL, "migrated_at" DATETIME NOT NULL)', [])
2023-11-22 02:19:47.445688954  [2023-11-22 02:19:47] peewee                         DEBUG   : ('SELECT "t1"."id", "t1"."name", "t1"."migrated_at" FROM "migratehistory" AS "t1" ORDER BY "t1"."id"', [])
2023-11-22 02:19:47.458105680  [2023-11-22 02:19:47] peewee_migrate.logs            INFO    : There is nothing to migrate
2023-11-22 02:19:47.472195634  [2023-11-22 02:19:47] frigate.app                    INFO    : Recording process started: 731
2023-11-22 02:19:47.473782056  [2023-11-22 02:19:47] frigate.app                    INFO    : go2rtc process pid: 89
2023-11-22 02:19:47.476452730  [2023-11-22 02:19:47] asyncio                        DEBUG   : Using selector: EpollSelector
2023-11-22 02:19:47.487374380  [2023-11-22 02:19:47] frigate.comms.mqtt             DEBUG   : MQTT connected
2023-11-22 02:19:47.489083332  [2023-11-22 02:19:47] detector.cpu                   INFO    : Starting detection process: 742
2023-11-22 02:19:47.490827492  [2023-11-22 02:19:47] frigate.app                    INFO    : Output process started: 744
2023-11-22 02:19:47.491090979  [2023-11-22 02:19:47] frigate.detectors              WARNING : CPU detectors are not recommended and should only be used for testing or for trial purposes.
2023-11-22 02:19:47.502172719  [2023-11-22 02:19:47] peewee.sqliteq                 DEBUG   : received query DELETE FROM "regions" WHERE NOT ("regions"."camera" IN (?))
2023-11-22 02:19:47.502234245  [2023-11-22 02:19:47] peewee                         DEBUG   : ('DELETE FROM "regions" WHERE NOT ("regions"."camera" IN (?))', ['FrontHigha'])
2023-11-22 02:19:47.515907803  [2023-11-22 02:19:47] peewee                         DEBUG   : ('SELECT "t1"."camera", "t1"."grid", "t1"."last_update" FROM "regions" AS "t1" WHERE ("t1"."camera" = ?) LIMIT ? OFFSET ?', ['FrontHigha', 1, 0])
2023-11-22 02:19:47.534830811  [2023-11-22 02:19:47] peewee                         DEBUG   : ('SELECT "t1"."id" FROM "event" AS "t1" WHERE ((("t1"."camera" = ?) AND (("t1"."false_positive" IS ?) OR ("t1"."false_positive" = ?))) AND ("t1"."start_time" > ?))', ['FrontHigha', None, False, 1700448326.693565])
2023-11-22 02:19:47.546625256  [2023-11-22 02:19:47] frigate.util.object            DEBUG   : Found 0 new events for FrontHigha
2023-11-22 02:19:47.554545993  [2023-11-22 02:19:47] frigate.app                    INFO    : Camera processor started for FrontHigha: 755
2023-11-22 02:19:47.555655977  [2023-11-22 02:19:47] frigate.app                    INFO    : Capture process started for FrontHigha: 756
2023-11-22 02:19:47.555681705  [2023-11-22 02:19:47] peewee                         DEBUG   : ('SELECT COUNT(?) FROM "recordings" AS "t1" WHERE (("t1"."camera" = ?) AND ("t1"."segment_size" > ?))', ['*', 'FrontHigha', 0.0])
2023-11-22 02:19:47.559555861  [2023-11-22 02:19:47] urllib3.connectionpool         DEBUG   : Starting new HTTPS connection (1): api.github.com:443
2023-11-22 02:19:47.571882717  Process camera_processor:FrontHigha:
2023-11-22 02:19:47.572645419  Traceback (most recent call last):
2023-11-22 02:19:47.572668172    File "/usr/lib/python3.9/multiprocessing/process.py", line 315, in _bootstrap
2023-11-22 02:19:47.572669013      self.run()
2023-11-22 02:19:47.572669685    File "/usr/lib/python3.9/multiprocessing/process.py", line 108, in run
2023-11-22 02:19:47.572670135      self._target(*self._args, **self._kwargs)
2023-11-22 02:19:47.572670556    File "/opt/frigate/frigate/video.py", line 436, in track_camera
2023-11-22 02:19:47.572678882      process_frames(
2023-11-22 02:19:47.572679383    File "/opt/frigate/frigate/video.py", line 532, in process_frames
2023-11-22 02:19:47.572680064      next_region_update = get_tomorrow_at_time(2)
2023-11-22 02:19:47.572680535    File "/opt/frigate/frigate/util/builtin.py", line 269, in get_tomorrow_at_time
2023-11-22 02:19:47.572681437      tomorrow = datetime.datetime.now(get_localzone()) + datetime.timedelta(days=1)
2023-11-22 02:19:47.572688710    File "/usr/local/lib/python3.9/dist-packages/tzlocal/unix.py", line 219, in get_localzone
2023-11-22 02:19:47.572689362      _cache_tz = _get_localzone()
2023-11-22 02:19:47.572689863    File "/usr/local/lib/python3.9/dist-packages/tzlocal/unix.py", line 176, in _get_localzone
2023-11-22 02:19:47.572693860      tzenv = utils._tz_from_env()
2023-11-22 02:19:47.572694441    File "/usr/local/lib/python3.9/dist-packages/tzlocal/utils.py", line 109, in _tz_from_env
2023-11-22 02:19:47.572694932      raise zoneinfo.ZoneInfoNotFoundError(
2023-11-22 02:19:47.572711323  zoneinfo._common.ZoneInfoNotFoundError: 'tzlocal() does not support non-zoneinfo timezones like America/Chicaco. \nPlease use a timezone in the form of Continent/City'
2023-11-22 02:19:47.823515899  [2023-11-22 02:19:47] peewee                         DEBUG   : ('SELECT AVG("t1"."segment_size" / ("t1"."end_time" - "t1"."start_time")) FROM "recordings" AS "t1" WHERE (("t1"."camera" = ?) AND ("t1"."segment_size" > ?)) LIMIT ?', ['FrontHigha', 0.0, 100])
2023-11-22 02:19:48.156571887  [2023-11-22 02:19:48] urllib3.connectionpool         DEBUG   : https://api.github.com:443 "GET /repos/blakeblackshear/frigate/releases/latest HTTP/1.1" 200 1767
2023-11-22 02:19:48.182892267  Exception in thread recording_cleanup:
2023-11-22 02:19:48.182947521  Traceback (most recent call last):
2023-11-22 02:19:48.183005009  [2023-11-22 02:19:48] peewee.sqliteq                 DEBUG   : received query UPDATE "event" SET "end_time" = ("event"."start_time" + ?) WHERE ("event"."end_time" IS ?)
2023-11-22 02:19:48.183249890    File "/usr/lib/python3.9/threading.py", line 954, in _bootstrap_inner
2023-11-22 02:19:48.183710829  [2023-11-22 02:19:48] peewee                         DEBUG   : ('UPDATE "event" SET "end_time" = ("event"."start_time" + ?) WHERE ("event"."end_time" IS ?)', [30, None])
2023-11-22 02:19:48.184568908      self.run()
2023-11-22 02:19:48.184570220    File "/opt/frigate/frigate/record/cleanup.py", line 182, in run
2023-11-22 02:19:48.184917737      next_sync = get_tomorrow_at_time(3)
2023-11-22 02:19:48.184919170    File "/opt/frigate/frigate/util/builtin.py", line 269, in get_tomorrow_at_time
2023-11-22 02:19:48.185318072      tomorrow = datetime.datetime.now(get_localzone()) + datetime.timedelta(days=1)
2023-11-22 02:19:48.185446102    File "/usr/local/lib/python3.9/dist-packages/tzlocal/unix.py", line 219, in get_localzone
2023-11-22 02:19:48.185547373      _cache_tz = _get_localzone()
2023-11-22 02:19:48.185561831    File "/usr/local/lib/python3.9/dist-packages/tzlocal/unix.py", line 176, in _get_localzone
2023-11-22 02:19:48.185859101      tzenv = utils._tz_from_env()
2023-11-22 02:19:48.185860343    File "/usr/local/lib/python3.9/dist-packages/tzlocal/utils.py", line 109, in _tz_from_env
2023-11-22 02:19:48.186314251      raise zoneinfo.ZoneInfoNotFoundError(
2023-11-22 02:19:48.186368986  zoneinfo._common.ZoneInfoNotFoundError: 'tzlocal() does not support non-zoneinfo timezones like America/Chicaco. \nPlease use a timezone in the form of Continent/City'
2023-11-22 02:19:52.475718250  [2023-11-22 02:19:52] asyncio                        DEBUG   : Using selector: EpollSelector
2023-11-22 02:19:53.604743634  [2023-11-22 02:19:53] asyncio                        DEBUG   : Using selector: EpollSelector
2023-11-22 02:19:56.609564676  [2023-11-22 02:19:56] frigate.storage                DEBUG   : FrontHigha has a bandwidth of 1056.75 MiB/hr.
2023-11-22 02:19:57.475781408  [2023-11-22 02:19:57] asyncio                        DEBUG   : Using selector: EpollSelector
2023-11-22 02:20:02.475916846  [2023-11-22 02:20:02] asyncio                        DEBUG   : Using selector: EpollSelector
2023-11-22 02:20:03.600602840  [2023-11-22 02:20:03] asyncio                        DEBUG   : Using selector: EpollSelector
2023-11-22 02:20:07.476029041  [2023-11-22 02:20:07] asyncio                        DEBUG   : Using selector: EpollSelector
2023-11-22 02:20:12.476168652  [2023-11-22 02:20:12] asyncio                        DEBUG   : Using selector: EpollSelector
2023-11-22 02:20:13.597880738  [2023-11-22 02:20:13] asyncio                        DEBUG   : Using selector: EpollSelector
2023-11-22 02:20:17.476328353  [2023-11-22 02:20:17] asyncio                        DEBUG   : Using selector: EpollSelector
2023-11-22 02:20:22.476440220  [2023-11-22 02:20:22] asyncio                        DEBUG   : Using selector: EpollSelector
2023-11-22 02:20:23.598780884  [2023-11-22 02:20:23] asyncio                        DEBUG   : Using selector: EpollSelector
2023-11-22 02:20:27.476567117  [2023-11-22 02:20:27] asyncio                        DEBUG   : Using selector: EpollSelector
2023-11-22 02:20:32.476688301  [2023-11-22 02:20:32] asyncio                        DEBUG   : Using selector: EpollSelector
2023-11-22 02:20:33.598860975  [2023-11-22 02:20:33] asyncio                        DEBUG   : Using selector: EpollSelector
2023-11-22 02:20:37.476797003  [2023-11-22 02:20:37] asyncio                        DEBUG   : Using selector: EpollSelector
2023-11-22 02:20:42.476890368  [2023-11-22 02:20:42] asyncio                        DEBUG   : Using selector: EpollSelector
2023-11-22 02:20:43.597461159  [2023-11-22 02:20:43] asyncio                        DEBUG   : Using selector: EpollSelector
2023-11-22 02:20:47.476985110  [2023-11-22 02:20:47] asyncio                        DEBUG   : Using selector: EpollSelector
2023-11-22 02:20:52.477084067  [2023-11-22 02:20:52] asyncio                        DEBUG   : Using selector: EpollSelector
2023-11-22 02:20:52.479699027  [2023-11-22 02:20:52] frigate.record.maintainer      WARNING : Unable to keep up with recording segments in cache for FrontHigha. Keeping the 5 most recent segments out of 6 and discarding the rest...
2023-11-22 02:20:53.599866618  [2023-11-22 02:20:53] asyncio                        DEBUG   : Using selector: EpollSelector
2023-11-22 02:20:57.477256723  [2023-11-22 02:20:57] asyncio                        DEBUG   : Using selector: EpollSelector
2023-11-22 02:20:58.186328733  [2023-11-22 02:20:58] frigate.stats                  DEBUG   : Starting stats collection
2023-11-22 02:20:58.186334043  [2023-11-22 02:20:58] asyncio                        DEBUG   : Using selector: EpollSelector
2023-11-22 02:20:58.202459447  [2023-11-22 02:20:58] frigate.stats                  DEBUG   : Finished stats collection
2023-11-22 02:21:02.477462841  [2023-11-22 02:21:02] asyncio                        DEBUG   : Using selector: EpollSelector
2023-11-22 02:21:02.480148853  [2023-11-22 02:21:02] frigate.record.maintainer      WARNING : Unable to keep up with recording segments in cache for FrontHigha. Keeping the 5 most recent segments out of 6 and discarding the rest...
2023-11-22 02:21:03.596718361  [2023-11-22 02:21:03] asyncio                        DEBUG   : Using selector: EpollSelector

**Comment by NickM-27** [comment]
we don't need all debug logs we just need recording debug logs, and these logs did not run long enough

**Comment by NickM-27** [comment]
what is your docker compose

**Comment by doug62** [comment]
@NickM-27 (Thanks for looking into this) - I don't use docker compose, I have used Kubernetes + Frigate for 2 years, Kubernetes runs images just like docker (but many more options) - The deployment manifest is:
apiVersion: apps/v1
kind: Deployment
metadata:
  name: frigate
  namespace: frigate
  labels:
    app: frigate
spec:
  progressDeadlineSeconds: 600
  replicas: 1
  selector:
    matchLabels:
      app: frigate
  template:
    metadata:
      labels:
        app: frigate
    spec:
      containers:
      - env:
        - name: FRIGATE_RTSP_PASSWORD
        - name: PASSWD
          value: password
        - name: TZ
          value: America/Chicaco
        # image: blakeblackshear/frigate:stable-amd64
        # image: blakeblackshear/frigate:0.12.0-beta2
        image: ghcr.io/blakeblackshear/frigate:0.13.0-beta5
#        image: ghcr.io/blakeblackshear/frigate:stable
        imagePullPolicy: Always
        livenessProbe:
          failureThreshold: 3
          periodSeconds: 10
          successThreshold: 1
          tcpSocket:
            port: 5000
          timeoutSeconds: 1
        name: frigate
        ports:
        - containerPort: 5000
          name: frigate
          protocol: TCP
        - containerPort: 8554
          name: frigate-rtsp
          protocol: TCP
        readinessProbe:
          failureThreshold: 3
          periodSeconds: 10
          successThreshold: 1
          tcpSocket:
            port: 5000
          timeoutSeconds: 1
        resources:
          requests:
            cpu: 5000m
            memory: 6000Mi
          limits:
            cpu: 8000m
            memory: 7000Mi
        securityContext:
          privileged: false
        startupProbe:
          failureThreshold: 30
          periodSeconds: 5
          successThreshold: 1
          tcpSocket:
            port: 5000
          timeoutSeconds: 1
        terminationMessagePath: /dev/termination-log
        terminationMessagePolicy: File
        volumeMounts:
        - mountPath: /media/frigate
          name: doug-media
        - mountPath: /dev/shm
          name: cache
        - mountPath: /config
          name: doug-media
          subPath: config
        - mountPath: /config/config.yml
          name: config
          subPath: config.yml
      dnsPolicy: ClusterFirst
      enableServiceLinks: true
      restartPolicy: Always
      schedulerName: default-scheduler
      securityContext: {}
      serviceAccount: default
      serviceAccountName: default
      terminationGracePeriodSeconds: 30
      volumes:
      - emptyDir:
          medium: Memory
          sizeLimit: 1Gi
        name: cache
      - configMap:
          defaultMode: 420
          name: frigate-config
        name: config
      # - name: media-frigate-vol
      #   persistentVolumeClaim:
      #     claimName: frigate-pvc
      - nfs:
          path: /mnt/pool/nfs/frigate
          server: nas.cloud10.systems
        name: doug-media
      # - nfs:
      #     path: /mnt/pool/nfs/frigate/config
      #     server: nas.cloud10.systems
      #     name: config-nas

**Comment by doug62** [comment]
Frigate logs: (note, the pod has 6 cores avail, with 6 cams it's CPU was 1.4 cores, now with 1 cam it is around .4 cores so it should have enough compute to do things. 

TCP dump shows rtsp traffic:
4:36:53.434408 IP frigate-679cf9d966-5z27p.42650 > cam-front-high.lan.cloud10.systems.554: Flags [.], ack 628573, win 14348, options [nop,nop,TS val 1163623187 ecr 3631569573], length 0
04:36:53.435318 IP cam-front-high.lan.cloud10.systems.554 > frigate-679cf9d966-5z27p.42650: Flags [P.], seq 628573:629101, ack 294, win 4005, options [nop,nop,TS val 3631569574 ecr 1163623187], length 528: RTSP
04:36:53.435345 IP frigate-679cf9d966-5z27p.42650 > cam-front-high.lan.cloud10.systems.554: Flags [.], ack 629101, win 14348, options [nop,nop,TS val 1163623187 ecr 3631569574], length 0
04:36:53.498418 IP cam-front-high.lan.cloud10.systems.554 > frigate-679cf9d966-5z27p.42650: Flags [P.], seq 629101:629105, ack 294, win 4005, options [nop,nop,TS val 3631569637 ecr 1163623187], length 4: RTSP
04:36:53.498516 IP frigate-679cf9d966-5z27p.42650 > cam-front-high.lan.cloud10.systems.554: Flags [.], ack 629105, win 14348, options [nop,nop,TS val 1163623251 ecr 3631569637], length 0
04:36:53.499433 IP cam-front-high.lan.cloud10.systems.554 > frigate-679cf9d966-5z27p.42650: Flags [P.], seq 629105:629633, ack 294, win 4005, options [nop,nop,TS val 3631569638 ecr 1163623251], length 528: RTSP
04:36:53.499466 IP frigate-679cf9d966-5z27p.42650 > cam-front-high.lan.cloud10.systems.554: Flags [.], ack 629633, win 14348, options [nop,nop,TS val 1163623252 ecr 3631569638], length 0
04:36:53.516872 IP cam-front-high.lan.cloud10.systems.554 > frigate-679cf9d966-5z27p.42650: Flags [P.], seq 629633:629637, ack 294, win 4005, options [nop,nop,TS val 3631569655 ecr 1163623252], length 4: RTSP
04:36:53.516940 IP frigate-679cf9d966-5z27p.42650 > cam-front-high.lan.cloud10.systems.554: Flags [.], ack 629637, win 14348, options [nop,nop,TS val 1163623269 ecr 3631569655], length 0
04:36:53.517132 IP cam-front-high.lan.cloud10.systems.554 > frigate-679cf9d966-5z27p.42650: Flags [.], seq 629637:631035, ack 294, win 4005, options [nop,nop,TS val 3631569655 ecr 1163623252], length 1398: RTSP
04:36:53.517270 IP cam-front-high.lan.cloud10.systems.554 > frigate-679cf9d966-5z27p.42650: Flags [.], seq 631035:632433, ack 294, win 4005, options [nop,nop,TS val 3631569656 ecr 1163623252], length 1398: RTSP
04:36:53.517305 IP frigate-679cf9d966-5z27p.42650 > cam-front-high.lan.cloud10.systems.554: Flags [.], ack 632433, win 14348, options [nop,nop,TS val 1163623269 ecr 3631569655], length 0
04:36:53.517918 IP cam-front-high.lan.cloud10.systems.554 > frigate-679cf9d966-5z27p.42650: Flags [P.], seq 632433:633369, ack 294, win 4005, options [nop,nop,TS val 3631569656 ecr 1163623269], length 936: RTSP
04:36:53.517961 IP frigate-679cf9d966-5z27p.42650 > cam-front-high.lan.cloud10.systems.554: Flags [.], ack 633369, win 14348, options [nop,nop,TS val 1163623270 ecr 3631569656], length 0


Frigate Logs:
FrontHigha. Keeping the 5 most recent segments out of 6 and discarding the rest...
2023-11-22 04:30:07.674105811  [2023-11-22 04:30:07] asyncio                        DEBUG   : Using selector: EpollSelector
2023-11-22 04:30:09.589513206  [2023-11-22 04:30:09] asyncio                        DEBUG   : Using selector: EpollSelector
2023-11-22 04:30:12.674186545  [2023-11-22 04:30:12] asyncio                        DEBUG   : Using selector: EpollSelector
2023-11-22 04:30:12.676622496  [2023-11-22 04:30:12] frigate.record.maintainer      WARNING : Unable to keep up with recording segments in cache for FrontHigha. Keeping the 5 most recent segments out of 6 and discarding the rest...
2023-11-22 04:30:17.674349670  [2023-11-22 04:30:17] asyncio                        DEBUG   : Using selector: EpollSelector
2023-11-22 04:30:19.587920797  [2023-11-22 04:30:19] asyncio                        DEBUG   : Using selector: EpollSelector
2023-11-22 04:30:22.674410355  [2023-11-22 04:30:22] asyncio                        DEBUG   : Using selector: EpollSelector
2023-11-22 04:30:22.676888907  [2023-11-22 04:30:22] frigate.record.maintainer      WARNING : Unable to keep up with recording segments in cache for FrontHigha. Keeping the 5 most recent segments out of 6 and discarding the rest...
2023-11-22 04:30:27.674561969  [2023-11-22 04:30:27] asyncio                        DEBUG   : Using selector: EpollSelector
2023-11-22 04:30:29.587663078  [2023-11-22 04:30:29] asyncio                        DEBUG   : Using selector: EpollSelector
2023-11-22 04:30:32.674675376  [2023-11-22 04:30:32] asyncio                        DEBUG   : Using selector: EpollSelector
2023-11-22 04:30:32.677179451  [2023-11-22 04:30:32] frigate.record.maintainer      WARNING : Unable to keep up with recording segments in cache for FrontHigha. Keeping the 5 most recent segments out of 6 and discarding the rest...
2023-11-22 04:30:37.674797869  [2023-11-22 04:30:37] asyncio                        DEBUG   : Using selector: EpollSelector
2023-11-22 04:30:39.587922985  [2023-11-22 04:30:39] asyncio                        DEBUG   : Using selector: EpollSelector
2023-11-22 04:30:42.674969522  [2023-11-22 04:30:42] asyncio                        DEBUG   : Using selector: EpollSelector
2023-11-22 04:30:42.677529478  [2023-11-22 04:30:42] frigate.record.maintainer      WARNING : Unable to keep up with recording segments in cache for FrontHigha. Keeping the 5 most recent segments out of 6 and discarding the rest...

**Comment by doug62** [comment]
Thanks for your time.

The /tmp/cache dir will be automatically created as an ephemeral layer in the container for Docker & K8 so that's covered.  This was working on stable.

How can I change the logs to be more helpful?  The Frigate logs are an endless loop of "Unable to keep up with recording"

**Comment by NickM-27** [comment]
We only need recording debug logs so please remove other debug log config and we need a full copy of logd after letting frigate run for multiple minutes

**Comment by doug62** [comment]
Here you go:  Includes startup and running - constant dropped frames.

    logger:
      logs:
        frigate.record.maintainer: debug


2023-11-22 19:28:50.199205739  [INFO] Preparing Frigate...
2023-11-22 19:28:50.205240322  [INFO] Starting Frigate...
2023-11-22 19:28:51.210371022  [2023-11-22 19:28:51] frigate.app                    INFO    : Starting Frigate (0.13.0-aa93d4f)
2023-11-22 19:28:51.212322462  [2023-11-22 19:28:51] frigate.app                    INFO    : Creating directory: /tmp/cache
2023-11-22 19:28:51.246810832  [2023-11-22 19:28:51] peewee_migrate.logs            INFO    : Starting migrations
2023-11-22 19:28:51.297222379  [2023-11-22 19:28:51] peewee_migrate.logs            INFO    : There is nothing to migrate
2023-11-22 19:28:51.310491470  [2023-11-22 19:28:51] frigate.app                    INFO    : Recording process started: 731
2023-11-22 19:28:51.311933448  [2023-11-22 19:28:51] frigate.app                    INFO    : go2rtc process pid: 101
2023-11-22 19:28:51.326806115  [2023-11-22 19:28:51] detector.cpu                   INFO    : Starting detection process: 741
2023-11-22 19:28:51.330004207  [2023-11-22 19:28:51] frigate.app                    INFO    : Output process started: 743
2023-11-22 19:28:51.330170231  [2023-11-22 19:28:51] frigate.detectors              WARNING : CPU detectors are not recommended and should only be used for testing or for trial purposes.
2023-11-22 19:28:51.382607448  [2023-11-22 19:28:51] frigate.app                    INFO    : Camera processor started for FrontHigha: 754
2023-11-22 19:28:51.387583405  [2023-11-22 19:28:51] frigate.app                    INFO    : Capture process started for FrontHigha: 755
2023-11-22 19:28:51.403568439  Process camera_processor:FrontHigha:
2023-11-22 19:28:51.404473777  Traceback (most recent call last):
2023-11-22 19:28:51.404494646    File "/usr/lib/python3.9/multiprocessing/process.py", line 315, in _bootstrap
2023-11-22 19:28:51.404495368      self.run()
2023-11-22 19:28:51.404495969    File "/usr/lib/python3.9/multiprocessing/process.py", line 108, in run
2023-11-22 19:28:51.404499956      self._target(*self._args, **self._kwargs)
2023-11-22 19:28:51.404501098    File "/opt/frigate/frigate/video.py", line 436, in track_camera
2023-11-22 19:28:51.404509785      process_frames(
2023-11-22 19:28:51.404510316    File "/opt/frigate/frigate/video.py", line 532, in process_frames
2023-11-22 19:28:51.404510967      next_region_update = get_tomorrow_at_time(2)
2023-11-22 19:28:51.404511448    File "/opt/frigate/frigate/util/builtin.py", line 269, in get_tomorrow_at_time
2023-11-22 19:28:51.404512270      tomorrow = datetime.datetime.now(get_localzone()) + datetime.timedelta(days=1)
2023-11-22 19:28:51.404521096    File "/usr/local/lib/python3.9/dist-packages/tzlocal/unix.py", line 219, in get_localzone
2023-11-22 19:28:51.404521737      _cache_tz = _get_localzone()
2023-11-22 19:28:51.404522238    File "/usr/local/lib/python3.9/dist-packages/tzlocal/unix.py", line 176, in _get_localzone
2023-11-22 19:28:51.404526236      tzenv = utils._tz_from_env()
2023-11-22 19:28:51.404526827    File "/usr/local/lib/python3.9/dist-packages/tzlocal/utils.py", line 109, in _tz_from_env
2023-11-22 19:28:51.404527268      raise zoneinfo.ZoneInfoNotFoundError(
2023-11-22 19:28:51.404531225  zoneinfo._common.ZoneInfoNotFoundError: 'tzlocal() does not support non-zoneinfo timezones like America/Chicaco. \nPlease use a timezone in the form of Continent/City'
2023-11-22 19:28:51.591598460  Exception in thread recording_cleanup:
2023-11-22 19:28:51.591623016  Traceback (most recent call last):
2023-11-22 19:28:51.591624319    File "/usr/lib/python3.9/threading.py", line 954, in _bootstrap_inner
2023-11-22 19:28:51.592710137      self.run()
2023-11-22 19:28:51.592711549    File "/opt/frigate/frigate/record/cleanup.py", line 182, in run
2023-11-22 19:28:51.593036491      next_sync = get_tomorrow_at_time(3)
2023-11-22 19:28:51.593037844    File "/opt/frigate/frigate/util/builtin.py", line 269, in get_tomorrow_at_time
2023-11-22 19:28:51.593179061      tomorrow = datetime.datetime.now(get_localzone()) + datetime.timedelta(days=1)
2023-11-22 19:28:51.593204209    File "/usr/local/lib/python3.9/dist-packages/tzlocal/unix.py", line 219, in get_localzone
2023-11-22 19:28:51.593416800      _cache_tz = _get_localzone()
2023-11-22 19:28:51.593418163    File "/usr/local/lib/python3.9/dist-packages/tzlocal/unix.py", line 176, in _get_localzone
2023-11-22 19:28:51.593494957      tzenv = utils._tz_from_env()
2023-11-22 19:28:51.593496721    File "/usr/local/lib/python3.9/dist-packages/tzlocal/utils.py", line 109, in _tz_from_env
2023-11-22 19:28:51.593606848      raise zoneinfo.ZoneInfoNotFoundError(
2023-11-22 19:28:51.593627187  zoneinfo._common.ZoneInfoNotFoundError: 'tzlocal() does not support non-zoneinfo timezones like America/Chicaco. \nPlease use a timezone in the form of Continent/City'
2023-11-22 19:29:56.318710564  [2023-11-22 19:29:56] frigate.record.maintainer      WARNING : Unable to keep up with recording segments in cache for FrontHigha. Keeping the 5 most recent segments out of 6 and discarding the rest...
2023-11-22 19:30:06.318358160  [2023-11-22 19:30:06] frigate.record.maintainer      WARNING : Unable to keep up with recording segments in cache for FrontHigha. Keeping the 5 most recent segments out of 6 and discarding the rest...
2023-11-22 19:30:16.319420880  [2023-11-22 19:30:16] frigate.record.maintainer      WARNING : Unable to keep up with recording segments in cache for FrontHigha. Keeping the 5 most recent segments out of 6 and discarding the rest...
2023-11-22 19:30:26.318539008  [2023-11-22 19:30:26] frigate.record.maintainer      WARNING : Unable to keep up with recording segments in cache for FrontHigha. Keeping the 5 most recent segments out of 6 and discarding the rest...
2023-11-22 19:30:36.318923999  [2023-11-22 19:30:36] frigate.record.maintainer      WARNING : Unable to keep up with recording segments in cache for FrontHigha. Keeping the 5 most recent segments out of 6 and discarding the rest...
2023-11-22 19:30:46.319079008  [2023-11-22 19:30:46] frigate.record.maintainer      WARNING : Unable to keep up with recording segments in cache for FrontHigha. Keeping the 5 most recent segments out of 6 and discarding the rest...
2023-11-22 19:30:56.319357798  [2023-11-22 19:30:56] frigate.record.maintainer      WARNING : Unable to keep up with recording segments in cache for FrontHigha. Keeping the 5 most recent segments out of 6 and discarding the rest...
2023-11-22 19:31:06.319558388  [2023-11-22 19:31:06] frigate.record.maintainer      WARNING : Unable to keep up with recording segments in cache for FrontHigha. Keeping the 5 most recent segments out of 6 and discarding the rest...
2023-11-22 19:31:16.319740682  [2023-11-22 19:31:16] frigate.record.maintainer      WARNING : Unable to keep up with recording segments in cache for FrontHigha. Keeping the 5 most recent segments out of 6 and discarding the rest...

**Comment by Dibblah1** [comment]
I don't have logs prior to the change, but I have seen this symptom (with 0.13 beta) prior to changing the cameras from h.265 to h.264. 

No other changes, cameras are the same, just the configuration on the camera altered to use the other codec.

Don't know if this helps narrow the problem down.

**Comment by NickM-27** [comment]
The problem here is something when frigate tries to get the time in the local timezone causing the video and recordings threads to crash.

**Comment by NickM-27** [comment]
We will need to catch this and potentially put a warning.

**Comment by doug62** [comment]
For the TimeZone - that section should be wrapped in a non fatal error that produces a log entry.

I followed the directions on: https://docs.frigate.video/frigate/installation/  which says TZs should be formatted like https://en.wikipedia.org/wiki/List_of_tz_database_time_zones  which says my TZ is: America/Chicago and I set it by setting an environment var of TZ: America/Chicago so I think I set it correctly?

AND! - When I remove my TZ: America/Chicago entry **** IT WORKS ***

**Comment by NickM-27** [comment]
It might need to be surrounded by quotes or something, not sure why it wouldn't work.

**Comment by pos-ei-don** [comment]
See #8636

**Comment by doug62** [comment]
OH DEAR LORD!  I have: America/Chicaco   Should have been America/Chicago

**Comment by NickM-27** [comment]
Regardless we will need to catch that exception, we can use #8636 to cover that
