### DISCUSSION TITLE
[Support]: Frigate 0.14: after upgrading from 0.13 manually created events via HTTP API are mostly not displayed

### DISCUSSION THREAD

**Discussion by MaxRower** [blakeblackshear/frigate#12930] [Config Support] [answered]
### Describe the problem you are having

Alongside my cameras I have PIR sensors. When a sensor reports motion, I create an event for that camera via the HTTP API. When motion is no longer detected, the event is ended. That way, I don't have to enable motion detection or object detection on a slow NUC5CAYH without coral.
With frigate 0.13 this worked fine, all events showed up. But since the upgrade to 0.14, I have only three of them visible in alerts, from numerous other new events.

### Steps to reproduce

n/a

### Version

0.14.0-da913d8

### Frigate config file

```yaml
ui:
  strftime_fmt: "%Y-%m-%d %H:%M:%S"
  time_format: 24hour
mqtt:
  enabled: true
  host: ********
  user:
  password:
ffmpeg:
  hwaccel_args:
#  - preset-vaapi
    - -hwaccel
    - vaapi
    - -hwaccel_device
    - /dev/dri/renderD128
    - -hwaccel_output_format
    - yuv420p
#audio: # <- enable audio events for all camera
#  enabled: True
go2rtc:
  streams:
    stream_keller_high: # <- for RTSP streams
      - rtsp://********/live.sdp # <- stream which supports video & aac audio
      - ffmpeg:stream_keller_high#audio=aac   # <- copy of the stream which transcodes audio to the missing codec (usually will be opus)
    stream_keller_low: # <- for RTSP streams
      - rtsp://********/live3.sdp # <- stream which supports video & aac audio
      - ffmpeg:stream_keller_low#audio=aac   # <- copy of the stream which transcodes audio to the missing codec (usually will be opus)
    stream_vorzimmer_high: # <- for RTSP streams
      - rtsp://********/live.sdp # <- stream which supports video & aac audio
      - ffmpeg:stream_vorzimmer_high#audio=aac   # <- copy of the stream which transcodes audio to the missing codec (usually will be opus)
    stream_vorzimmer_low: # <- for RTSP streams
      - rtsp://********/live3.sdp # <- stream which supports video & aac audio
      - ffmpeg:stream_vorzimmer_low#audio=aac   # <- copy of the stream which transcodes audio to the missing codec (usually will be opus)
cameras:
  Keller:
    live:
      stream_name: stream_keller_low
    audio:
      enabled: true
    ffmpeg:
      hwaccel_args: preset-vaapi
      inputs:
#       - path: rtsp://********/live.sdp
        - path: rtsp://127.0.0.1:8554/stream_keller_high?video&audio
          input_args: preset-rtsp-restream
          roles:
            - record
            - audio
#     - path: rtsp://********/live3.sdp
        - path: rtsp://127.0.0.1:8554/stream_keller_low?video&audio
          input_args: preset-rtsp-restream
          roles:
            - detect
#      audio:
#        enabled: True
#      hwaccel_args: preset-vaapi
      output_args:
        record: preset-record-generic-audio-aac
    objects:
      track:
        - person
        - cat
        - bicycle
#        - car
#        - motorcycle
      filters:
        bicycle:
          mask:
            - 294,106,308,420
    detect:
      enabled: false
      width: 1280
      height: 720
    record:
      enabled: true
      retain:
        days: 7
        mode: all
    snapshots:
      enabled: true
  Vorzimmer:
    live:
      stream_name: stream_vorzimmer_low
    audio:
      enabled: true
    ffmpeg:
      inputs:
#       - path: rtsp://********/live.sdp
        - path: rtsp://127.0.0.1:8554/stream_vorzimmer_high?video&audio
          input_args: preset-rtsp-restream
          roles:
            - record
            - audio
#       - path: rtsp://********/live3.sdp
        - path: rtsp://127.0.0.1:8554/stream_vorzimmer_low?video&audio
          input_args: preset-rtsp-restream
          roles:
            - detect
#      audio:
#        enabled: True
#      hwaccel_args: preset-vaapi
      output_args:
        record: preset-record-generic-audio-aac
    objects:
      track:
        - person
#       - cat
#       - bicycle
#       - car
#       - motorcycle
    detect:
      enabled: false
      width: 1280
      height: 720
    record:
      enabled: true
      retain:
        days: 7
        mode: all
    snapshots:
      enabled: true
  Wohnzimmer:
    ffmpeg:
      inputs:
        - path: rtsp://********/live.sdp
          roles:
            - record
        - path: rtsp://********/live3.sdp
          roles:
            - detect
      hwaccel_args: preset-vaapi
    objects:
      track:
        - person
#       - cat
#       - bicycle
#       - car
#       - motorcycle
    detect:
      enabled: false
      width: 1280
      height: 720
    record:
      enabled: true
      retain:
        days: 7
        mode: all
    snapshots:
      enabled: true
  Kueche:
    ffmpeg:
      inputs:
        - path: rtsp://********/streaming/Channels/1
          roles:
            - record
        - path: rtsp://********/streaming/Channels/2
          roles:
            - detect
      hwaccel_args: preset-vaapi
#      output_args:
#        detect: -vf scale=1024:576
    objects:
      track:
        - person
#       - cat
#       - bicycle
#       - car
#       - motorcycle
    detect:
      enabled: false
      width: 704
      height: 576
    record:
      enabled: true
      retain:
        days: 7
        mode: all
    snapshots:
      enabled: true
detectors:
  cpu1:
    type: cpu
    num_threads: 3
#detectors:
#  ov:
#    type: openvino
#    device: GPU
#    model:
#      path: /openvino-model/ssdlite_mobilenet_v2.xml
version: 0.14
```

### Relevant log output

```shell
{"log":"2024-08-10 17:40:55.876274459  172.18.0.1 - - [10/Aug/2024:17:40:55 +0200] \"POST /api/events/Vorzimmer/PIR/create HTTP/1.1\" 200 95 \"-\" \"curl/8.7
.1\" \"-\"\n","stream":"stdout","time":"2024-08-10T15:40:55.876926355Z"}
{"log":"2024-08-10 17:41:40.733913516  172.18.0.1 - - [10/Aug/2024:17:41:40 +0200] \"PUT /api/events/1723304455.695401-dhevkr/end HTTP/1.1\" 200 55 \"-\" \"c
url/8.7.1\" \"-\"\n","stream":"stdout","time":"2024-08-10T15:41:40.734238939Z"}
```

### Operating system

Other Linux

### Install method

Docker Compose

### Network connection

Wired

### Camera make and model

VIVOTEK FD8167

**Comment by NickM-27** [comment]
It's not clear what you mean, custom events are displayed as alerts

**Reply by MaxRower** [reply]
Maybe that's the way it should work, but mostly, it doesn't work here. I have only three alerts displayed, all recent ones are missing.

**Reply by MaxRower** [reply]
I restarted frigate now, next two events showed up. Let's see, how many more...

**Reply by MaxRower** [reply]
There seems to be an error when ending the event?

```
{"log":"2024-08-10 18:29:03.256975947  172.18.0.1 - - [10/Aug/2024:18:29:03 +0200] \"PUT /api/events/1723307283.254277-yqar8z/end HTTP/1.1\" 200 55 \"-\" \"curl/8.7.1\" \"-\"\n","stream":"stdout","time":"2024-08-10T16:29:03.257291782Z"}
{"log":"2024-08-10 18:29:03.260715229      self.run()\n","stream":"stdout","time":"2024-08-10T16:29:03.261054952Z"}
{"log":"2024-08-10 18:29:03.260785194    File \"/opt/frigate/frigate/review/maintainer.py\", line 506, in run\n","stream":"stdout","time":"2024-08-10T16:29:03.261206882Z"}
{"log":"2024-08-10 18:29:03.264149113      self.indefinite_events[camera].pop(manual_info[\"event_id\"])\n","stream":"stdout","time":"2024-08-10T16:29:03.26436677Z"}
{"log":"2024-08-10 18:29:03.264160076  KeyError: '1723307283.254277-yqar8z'\n","stream":"stdout","time":"2024-08-10T16:29:03.264453661Z"}
{"log":"2024-08-10 18:29:03.303759363  /usr/lib/python3.9/multiprocessing/resource_tracker.py:216: UserWarning: resource_tracker: There appear to be 2 leaked shared_memory objects to clean up at shutdown\n","stream":"stdout","time":"2024-08-10T16:29:03.304041097Z"}
{"log":"2024-08-10 18:29:03.303769939    warnings.warn('resource_tracker: There appear to be %d '\n","stream":"stdout","time":"2024-08-10T16:29:03.30412085Z"}
{"log":"2024-08-10 18:29:03.304305156  /usr/lib/python3.9/multiprocessing/resource_tracker.py:229: UserWarning: resource_tracker: '/Kueche1723307283.310672': [Errno 2] No such file or directory: '/Kueche1723307283.310672'\n","stream":"stdout","time":"2024-08-10T16:29:03.305273411Z"}
{"log":"2024-08-10 18:29:03.304315218    warnings.warn('resource_tracker: %r: %s' % (name, e))\n","stream":"stdout","time":"2024-08-10T16:29:03.305429266Z"}
{"log":"2024-08-10 18:29:03.304324531  /usr/lib/python3.9/multiprocessing/resource_tracker.py:229: UserWarning: resource_tracker: '/Vorzimmer1723307280.437325': [Errno 2] No such file or directory: '/Vorzimmer1723307280.437325'\n","stream":"stdout","time":"2024-08-10T16:29:03.305550533Z"}
{"log":"2024-08-10 18:29:03.304330569    warnings.warn('resource_tracker: %r: %s' % (name, e))\n","stream":"stdout","time":"2024-08-10T16:29:03.305606397Z"}
```

**Reply by NickM-27** [reply]
It looks like the end event ID includes a new line when it shouldn't, how are you sending it?

**Reply by MaxRower** [reply]
Those two events are still busy, so ending them seems to fail here.

**Reply by NickM-27** [reply]
Not sure what you mean "still busy". They are failing to be needed because the event ID has a newline character in it

**Reply by MaxRower** [reply]
The event ID is in the URL, and it does not include a new line, does it?

**Reply by MaxRower** [reply]
When I create a new event the output is like this:
`{"event_id":"1723307981.624851-eyhy76","message":"Successfully created event.","success":true}`

**Reply by MaxRower** [reply]
I cannot see a new line character anywhere.

**Reply by NickM-27** [reply]
I was looking at 

`KeyError: '1723307283.254277-yqar8z'\n"` but looks like that's just the log formatting. What is the  API call are you using to create the event

**Reply by MaxRower** [reply]
With "busy" I mean there is a rotating circle on the lower left of the alert preview. So it's not ended, apperently.

**Reply by MaxRower** [reply]
My two scripts, called by Home Assistant with parameters for the camera name and sub_lable. The returned event_id is stored to a file in /config/pir/ and is retrieved for ending the event.

frigate_record
`#!/bin/bash

if [ -z "$3" ]; then
  duration=60
else
 duration=$3
fi


event_id=`/usr/bin/curl -d "{\"sub_label\": \"$2\", \"duration\": $duration, \"include_recording\": true}" -H "Content-Type: application/json" -X POST http://localhost:5000/api/events/$1/PIR/create 2>/dev/null | grep -o '"event_id":"[^"]*"' | sed -e 's/.*://g' -e 's/"//g'`

echo $event_id > /config/pir/$1.event
`

frigate_record_end
`#!/bin/bash

#set -x

if [ -n "$1" ]; then
  file=/config/pir/$1.event

  if [ -f "$file" ]; then
    event_id=`cat $file`
    /usr/bin/curl -X PUT http://localhost:5000/api/events/$event_id/end
    rm $file
  fi
fi
`
Your right about the new line, with hexdump it showed up in the file. Strange it worked with frigate 0.13?

**Reply by MaxRower** [reply]
Added -n to the echo when writing the file, restarted frigate to end the pending events, but the behaviour is exactly the same. And there is no new line in the file now or in the event_id varable read back from that file, did a hexdump -C of both. Strange.

**Reply by MaxRower** [reply]
Yes, the curl command does not include a new line anymore after the event_id, see the following hexdump output, first part is the file contents, second part the curl command (preceded with echo piped into hexdump -C)

00000000  31 37 32 33 33 31 30 34  36 30 2e 39 33 36 38 37  |1723310460.93687|
00000010  2d 68 69 39 76 76 6e                              |-hi9vvn|
00000017

00000000  2f 75 73 72 2f 62 69 6e  2f 63 75 72 6c 20 2d 58  |/usr/bin/curl -X|
00000010  20 50 55 54 20 68 74 74  70 3a 2f 2f 6c 6f 63 61  | PUT http://loca|
00000020  6c 68 6f 73 74 3a 35 30  30 30 2f 61 70 69 2f 65  |lhost:5000/api/e|
00000030  76 65 6e 74 73 2f 31 37  32 33 33 31 30 34 36 30  |vents/1723310460|
00000040  2e 39 33 36 38 37 2d 68  69 39 76 76 6e 2f 65 6e  |.93687-hi9vvn/en|
00000050  64 0a                                             |d.|


Maybe there is a new line added inside the frigate code?

**Reply by MaxRower** [reply]
Did a tcpdump now:

```
19:51:01.165953 IP6 ::1.43030 > ::1.5000: Flags [P.], seq 1:117, ack 1, win 512, options [nop,nop,TS val 1531878130 ecr 1531878130], length 116
        0x0000:  0000 0000 0000 0000 0000 0000 86dd 600a  ..............`.
        0x0010:  1be4 0094 0640 0000 0000 0000 0000 0000  .....@..........
        0x0020:  0000 0000 0001 0000 0000 0000 0000 0000  ................
        0x0030:  0000 0000 0001 a816 1388 a97e e8ab f8b8  ...........~....
        0x0040:  d275 8018 0200 009c 0000 0101 080a 5b4e  .u............[N
        0x0050:  9af2 5b4e 9af2 5055 5420 2f61 7069 2f65  ..[N..PUT./api/e
        0x0060:  7665 6e74 732f 3137 3233 3331 3231 3937  vents/1723312197
        0x0070:  2e30 3035 3337 312d 3361 3064 3279 2f65  .005371-3a0d2y/e
        0x0080:  6e64 2048 5454 502f 312e 310d 0a48 6f73  nd.HTTP/1.1..Hos
        0x0090:  743a 206c 6f63 616c 686f 7374 3a35 3030  t:.localhost:500
        0x00a0:  300d 0a55 7365 722d 4167 656e 743a 2063  0..User-Agent:.c
        0x00b0:  7572 6c2f 382e 372e 310d 0a41 6363 6570  url/8.7.1..Accep
        0x00c0:  743a 202a 2f2a 0d0a 0d0a                 t:.*/*....
19:51:01.165969 IP6 ::1.5000 > ::1.43030: Flags [.], ack 117, win 511, options [nop,nop,TS val 1531878130 ecr 1531878130], length 0
        0x0000:  0000 0000 0000 0000 0000 0000 86dd 6005  ..............`.
        0x0010:  ad9a 0020 0640 0000 0000 0000 0000 0000  .....@..........
        0x0020:  0000 0000 0001 0000 0000 0000 0000 0000  ................
        0x0030:  0000 0000 0001 1388 a816 f8b8 d275 a97e  .............u.~
        0x0040:  e91f 8010 01ff 0028 0000 0101 080a 5b4e  .......(......[N
        0x0050:  9af2 5b4e 9af2                           ..[N..
19:51:01.181804 IP6 ::1.5000 > ::1.43030: Flags [P.], seq 1:235, ack 117, win 512, options [nop,nop,TS val 1531878146 ecr 1531878130], length 234
        0x0000:  0000 0000 0000 0000 0000 0000 86dd 6005  ..............`.
        0x0010:  ad9a 010a 0640 0000 0000 0000 0000 0000  .....@..........
        0x0020:  0000 0000 0001 0000 0000 0000 0000 0000  ................
        0x0030:  0000 0000 0001 1388 a816 f8b8 d275 a97e  .............u.~
        0x0040:  e91f 8018 0200 0112 0000 0101 080a 5b4e  ..............[N
        0x0050:  9b02 5b4e 9af2 4854 5450 2f31 2e31 2032  ..[N..HTTP/1.1.2
        0x0060:  3030 204f 4b0d 0a53 6572 7665 723a 206e  00.OK..Server:.n
        0x0070:  6769 6e78 2f31 2e32 352e 330d 0a44 6174  ginx/1.25.3..Dat
        0x0080:  653a 2053 6174 2c20 3130 2041 7567 2032  e:.Sat,.10.Aug.2
        0x0090:  3032 3420 3137 3a35 313a 3031 2047 4d54  024.17:51:01.GMT
        0x00a0:  0d0a 436f 6e74 656e 742d 5479 7065 3a20  ..Content-Type:.
        0x00b0:  6170 706c 6963 6174 696f 6e2f 6a73 6f6e  application/json
        0x00c0:  0d0a 436f 6e74 656e 742d 4c65 6e67 7468  ..Content-Length
        0x00d0:  3a20 3535 0d0a 436f 6e6e 6563 7469 6f6e  :.55..Connection
        0x00e0:  3a20 6b65 6570 2d61 6c69 7665 0d0a 4361  :.keep-alive..Ca
        0x00f0:  6368 652d 436f 6e74 726f 6c3a 206e 6f2d  che-Control:.no-
        0x0100:  7374 6f72 650d 0a0d 0a7b 226d 6573 7361  store....{"messa
        0x0110:  6765 223a 2245 7665 6e74 2073 7563 6365  ge":"Event.succe
        0x0120:  7373 6675 6c6c 7920 656e 6465 642e 222c  ssfully.ended.",
        0x0130:  2273 7563 6365 7373 223a 7472 7565 7d0a  "success":true}.
```


Corresponding log entries:
{"log":"2024-08-10 19:51:01.182109435  172.18.0.1 - - [10/Aug/2024:19:51:01 +0200] \"PUT /api/events/1723312197.005371-3a0d2y/end HTTP/1.1\" 200 55 \"-\" \"curl/8.7.1\" \"-\"\n","stream":"stdout","time":"2024-08-10T17:51:01.182338805Z"}
{"log":"2024-08-10 19:51:01.185630697      self.run()\n","stream":"stdout","time":"2024-08-10T17:51:01.18585428Z"}
{"log":"2024-08-10 19:51:01.185639623    File \"/opt/frigate/frigate/review/maintainer.py\", line 506, in run\n","stream":"stdout","time":"2024-08-10T17:51:01.185940307Z"}
{"log":"2024-08-10 19:51:01.185643298      self.indefinite_events[camera].pop(manual_info[\"event_id\"])\n","stream":"stdout","time":"2024-08-10T17:51:01.185971421Z"}
{"log":"2024-08-10 19:51:01.185653123  KeyError: '1723312197.005371-3a0d2y'\n","stream":"stdout","time":"2024-08-10T17:51:01.185998934Z"}

**Reply by NickM-27** [reply]
If you include a duration when creating the event then end api can't be called. It seems like that's what is happening here

**Reply by MaxRower** [reply]
> If you include a duration when creating the event then end api can't be called. It seems like that's what is happening here

Yes, I do include a duration of 60, but in the past with frigate 0.13 it worked that way. In the begining, I did not end the event, just used the default duration of those PIR sensors. Let's see, if removing the duration will help.

**Reply by MaxRower** [reply]
Removed the duration, but that does not help, the event is still ongoing/busy after sending the 'end'.

Log entries: 
{"log":"2024-08-10 20:10:56.017281654  Exception in thread review_segment_maintainer:\n","stream":"stdout","time":"2024-08-10T18:10:56.017582126Z"}
{"log":"2024-08-10 20:10:56.017354232  Traceback (most recent call last):\n","stream":"stdout","time":"2024-08-10T18:10:56.017665842Z"}
{"log":"2024-08-10 20:10:56.017359019    File \"/usr/lib/python3.9/threading.py\", line 954, in _bootstrap_inner\n","stream":"stdout","time":"2024-08-10T18:1
0:56.01769313Z"}
{"log":"2024-08-10 20:10:56.018754701      self.run()\n","stream":"stdout","time":"2024-08-10T18:10:56.018988696Z"}
{"log":"2024-08-10 20:10:56.018813916    File \"/opt/frigate/frigate/review/maintainer.py\", line 506, in run\n","stream":"stdout","time":"2024-08-10T18:10:5
6.019091224Z"}
{"log":"2024-08-10 20:10:56.019686143      self.indefinite_events[camera].pop(manual_info[\"event_id\"])\n","stream":"stdout","time":"2024-08-10T18:10:56.019
860411Z"}
{"log":"2024-08-10 20:10:56.019696756  KeyError: '1723313396.014084-dfto1t'\n","stream":"stdout","time":"2024-08-10T18:10:56.019913626Z"}
{"log":"2024-08-10 20:10:56.022459144  172.18.0.1 - - [10/Aug/2024:20:10:56 +0200] \"PUT /api/events/1723313396.014084-dfto1t/end HTTP/1.1\" 200 55 \"-\" \"c
url/8.7.1\" \"-\"\n","stream":"stdout","time":"2024-08-10T18:10:56.02271174Z"}
{"log":"2024-08-10 20:10:56.050600066  /usr/lib/python3.9/multiprocessing/resource_tracker.py:216: UserWarning: resource_tracker: There appear to be 2 leaked
 shared_memory objects to clean up at shutdown\n","stream":"stdout","time":"2024-08-10T18:10:56.050869975Z"}
{"log":"2024-08-10 20:10:56.050611292    warnings.warn('resource_tracker: There appear to be %d '\n","stream":"stdout","time":"2024-08-10T18:10:56.050954628Z
"}
{"log":"2024-08-10 20:10:56.050705882  /usr/lib/python3.9/multiprocessing/resource_tracker.py:229: UserWarning: resource_tracker: '/Vorzimmer1723313392.87482
': [Errno 2] No such file or directory: '/Vorzimmer1723313392.87482'\n","stream":"stdout","time":"2024-08-10T18:10:56.050982016Z"}
{"log":"2024-08-10 20:10:56.050710370    warnings.warn('resource_tracker: %r: %s' % (name, e))\n","stream":"stdout","time":"2024-08-10T18:10:56.051067194Z"}
{"log":"2024-08-10 20:10:56.050907439  /usr/lib/python3.9/multiprocessing/resource_tracker.py:229: UserWarning: resource_tracker: '/Kueche1723313395.974767':
 [Errno 2] No such file or directory: '/Kueche1723313395.974767'\n","stream":"stdout","time":"2024-08-10T18:10:56.051102457Z"}
{"log":"2024-08-10 20:10:56.050914339    warnings.warn('resource_tracker: %r: %s' % (name, e))\n","stream":"stdout","time":"2024-08-10T18:10:56.051129221Z"}

**Reply by MaxRower** [reply]
Is there a way to verify, what event_id belongs to the alert shown in the gui?

**Reply by MaxRower** [reply]
I tried to end the events with different event_id string, without the suffix, with the camera prefix, but none of them worked, and there were none of those errors logged with the attempts. So I think, the event_id is correct, but there is some sort of error, processing the end post. The events stay ongoing until I restart the frigate docker, and until I do this, there be can be no additional event created per camera.

**Reply by MaxRower** [reply]
I now took a brief look at the sqlite3 database. 
When an event is created  without a duration, there seems to be a default duration of 40 seconds, which is updated successfully, when the end post is done.

sqlite3 frigate.db "select start_time, end_time from event where id = '1723316685.975153-nv1vod';"
1723316680.97515|1723316720.97515
sqlite3 frigate.db "select start_time, end_time from event where id = '1723316685.975153-nv1vod';"
1723316680.97515|1723316751.66296

**Reply by MaxRower** [reply]
After a restart of the frigate container, the contents of the corresponding record in the event table did not change since the end POST, even if the event in the gui is now no longer ongoing. So that status has to be somewhere else, maybe not in the database at all?

**Reply by NickM-27** [reply, marked as answer]
A duration of null must be sent if the end API is going to be used. Seems it was fine in 0.13 but this is not as designed. I will create a PR to send an appropriate error message

**Reply by MaxRower** [reply]
Changed the code to set "duration": null, a now it does work as expected. Thank's a lot for your help, @NickM-27!

**Comment by ab3lson** [comment]
@NickM-27 Was the PR for this ever done? I'm having issues where I'm trying to create an event via the API and it isn't showing up in the GUI even though the response says an event was created.
```
{"event_id":"1725570247.993038-yf6eld","message":"Successfully created event.","success":true}
```

My request is being sent to `http://192.168.0.17:5000/api/events/doorbell/doorbell%20press/create` with body:
```
{
    "duration": 30,
    "include_recording": true
}
```

**Reply by NickM-27** [reply]
yes, it was fixed
